<?xml version="1.0" encoding="UTF-8"?>

<unit-definition 
    xmlns="http://www.b5gamer.net/B5Wars" 
    xmlns:xsi="http://www.w3.org/2001/XMLSchema-instance" 
    xsi:schemaLocation="http://www.b5gamer.net/B5Wars unit.xsd">

	<unit name="Dilgar Tratharti Gunship" hull="Tratharti" version="2" author="AOG" source="SF2">			
		<specs type="Capital Ship" pointValue="750" rammingFactor="250" />
		<maneuvering turnCost="2/3" turnDelay="2/3" accelDecelCost="3" pivotCost="2+2" rollCost="1+1" /> 		
		<combat-stats fwdAftDefense="13" stbPortDefense="15" initiativeModifier="0" />
		<service-history>
			<period-of-service faction="Dilgar" inService="2228" endedService="2232" availability="Base" deployment="Unlimited" />
		</service-history>
						
		<ship-definition>	
			<hit-location-charts>		
				<hit-location-chart name="FORWARD HITS">	 	
					<hit-location class="SystemHitLocation" from="1" to="4">
						<property name="systemType" value="Thruster" />
					</hit-location>
					<hit-location class="SystemHitLocation" from="5" to="6">
						<property name="systemType" value="Medium Laser Cannon" />
					</hit-location>
					<hit-location class="SystemHitLocation" from="7" to="9">
						<property name="systemType" value="Mass Driver" />
					</hit-location>
					<hit-location class="SystemHitLocation" from="10" to="18">
						<property name="systemType" value="Structure" />
					</hit-location>
					<hit-location class="SectionHitLocation" from="19" to="20">
						<property name="sectionName" value="PRIMARY" />
					</hit-location>
				</hit-location-chart>
				
				<hit-location-chart name="SIDE HITS">	 	
					<hit-location class="SystemHitLocation" from="1" to="6">
						<property name="systemType" value="Thruster" />
					</hit-location>
					<hit-location class="SystemHitLocation" from="7" to="10">
						<property name="systemType" value="Heavy Bolter" />
					</hit-location>
					<hit-location class="SystemHitLocation" from="11" to="18">
						<property name="systemType" value="Structure" />
					</hit-location>
					<hit-location class="SectionHitLocation" from="19" to="20">
						<property name="sectionName" value="PRIMARY" />
					</hit-location>
				</hit-location-chart>
		
				<hit-location-chart name="AFT HITS">	 	
					<hit-location class="SystemHitLocation" from="1" to="6">
						<property name="systemType" value="Thruster" />
					</hit-location>
					<hit-location class="SystemHitLocation" from="7" to="8">
						<property name="systemType" value="Heavy Bolter" />
					</hit-location>
					<hit-location class="SystemHitLocation" from="9" to="10">
						<property name="systemType" value="Scatter-Pulsar" />
					</hit-location>
					<hit-location class="SystemHitLocation" from="11" to="11">
						<property name="systemType" value="Engine" />
					</hit-location>
					<hit-location class="SystemHitLocation" from="12" to="18">
						<property name="systemType" value="Structure" />
					</hit-location>
					<hit-location class="SectionHitLocation" from="19" to="20">
						<property name="sectionName" value="PRIMARY" />
					</hit-location>
				</hit-location-chart>
		
				<hit-location-chart name="PRIMARY HITS">			
					<hit-location class="SystemHitLocation" from="1" to="13">
						<property name="systemType" value="Structure" />
					</hit-location>
					<hit-location class="SystemHitLocation" from="14" to="15">
						<property name="systemType" value="Sensors" />
					</hit-location>
					<hit-location class="SystemHitLocation" from="16" to="16">
						<property name="systemType" value="Engine" />
					</hit-location>
					<hit-location class="SystemHitLocation" from="17" to="17">
						<property name="systemType" value="Hangar" />
					</hit-location>
					<hit-location class="SystemHitLocation" from="18" to="19">
						<property name="systemType" value="Reactor" />
					</hit-location>
					<hit-location class="SystemHitLocation" from="20" to="20">
						<property name="systemType" value="C &amp; C" />
					</hit-location>
				</hit-location-chart>
			</hit-location-charts>
			
			<sections>
				<section name="FORWARD" class="StructureSection" arc="F60" hitLocationChart="FORWARD HITS">
					<systems>
						<system class="Structure" damageBoxes="40" armor="5" />
						<system class="Thruster" damageBoxes="8" armor="3" arc="F120">
							<property name="thrustRating" value="3" />
						</system>					
						<system class="Thruster" damageBoxes="8" armor="3" arc="F120">
							<property name="thrustRating" value="3" />
						</system>					
						<weapon type="Mass Driver" armor="5" arc="F60" number="1" />					
						<weapon type="Medium Laser Cannon" armor="3" arc="F120" number="2" />					
						<weapon type="Medium Laser Cannon" armor="3" arc="F120" number="3" />					
					</systems>
				</section>
			
				<section name="PORT" class="StructureSection" arc="P120" hitLocationChart="SIDE HITS">
					<systems>
						<system class="Structure" damageBoxes="48" armor="5" />
						<system class="Thruster" damageBoxes="11" armor="3" arc="P120">
							<property name="thrustRating" value="4" />
						</system>					
						<weapon type="Heavy Bolter" armor="2" arc="FP120" number="4" />					
						<weapon type="Heavy Bolter" armor="3" arc="FP120" number="5" />					
					</systems>
				</section>
		
				<section name="PRIMARY" class="StructureSection" hitLocationChart="PRIMARY HITS">
					<systems>
						<system class="Structure" damageBoxes="52" armor="5" />
						<system class="CommandAndControl" damageBoxes="15" armor="4" />
						<system class="Sensors" damageBoxes="12" armor="4" power="4">
							<property name="sensorRating" value="8" />
						</system>					
						<system class="Engine" damageBoxes="13" armor="4">
							<property name="freeThrust" value="6" />
							<property name="efficiency" value="3/1" />
						</system>					
						<system class="Reactor" damageBoxes="23" armor="4">
							<property name="availablePower" value="59" />
						</system>					
						<system class="Hangar" damageBoxes="2" armor="3">
							<property name="launchRate" value="2" />
						</system>					
					</systems>
				</section>
		
				<section name="STARBOARD" class="StructureSection" arc="S120" hitLocationChart="SIDE HITS">
					<systems>
						<system class="Structure" damageBoxes="48" armor="5" />
						<system class="Thruster" damageBoxes="11" armor="3" arc="S120">
							<property name="thrustRating" value="4" />
						</system>					
						<weapon type="Heavy Bolter" armor="3" arc="FS120" number="6" />					
						<weapon type="Heavy Bolter" armor="2" arc="FS120" number="7" />					
					</systems>
				</section>
			
				<section name="AFT" class="StructureSection" arc="A60" hitLocationChart="AFT HITS">
					<systems>
						<system class="Structure" damageBoxes="40" armor="5" />
						<system class="Thruster" damageBoxes="4" armor="2" arc="A120">
							<property name="thrustRating" value="2" />
						</system>					
						<system class="Thruster" damageBoxes="8" armor="3" arc="A120">
							<property name="thrustRating" value="3" />
						</system>					
						<system class="Thruster" damageBoxes="8" armor="3" arc="A120">
							<property name="thrustRating" value="3" />
						</system>					
						<system class="Thruster" damageBoxes="4" armor="2" arc="A120">
							<property name="thrustRating" value="2" />
						</system>
						<system class="Engine" damageBoxes="9" armor="3">
							<property name="freeThrust" value="4" />
							<property name="efficiency" value="3/1" />
						</system>					
						<weapon type="Heavy Bolter" armor="3" arc="A120" number="8" />					
						<weapon type="Heavy Bolter" armor="3" arc="A120" number="9" />					
						<weapon type="Scatter-Pulsar" armor="1" arc="AP180" number="10" />
						<weapon type="Scatter-Pulsar" armor="1" arc="AS180" number="11" />
					</systems>
				</section>
			</sections>
		</ship-definition>						
	</unit>				
</unit-definition>